{
  "schema": "session.v1",
  "session_id": "cmp",
  "question": "量化宽松(QE,2008-2021)在多大程度上是发达经济体(以美国为主)财富不平等扩大的『原因』,而非人口老龄化、技术偏向性进步、全球化等结构性力量在反事实情形下本来也会造成的结果?请区分资产价格渠道、储蓄者/借款者再分配渠道与宏观(就业/工资)渠道,并直面因果识别难题:如何把 QE 的边际因果效应从同期其他趋势中分离出来?给出有校准的判断。",
  "boundary_note": "聚焦美国2008-2021年QE(含欧元区/英国/日本作对比);评估资产价格、再分配、宏观就业三渠道;处理反事实识别问题;不展开对QE退出/加息周期后果的分析",
  "language": "zh",
  "budgets": {
    "max_depth": 4,
    "max_children": 5,
    "max_open_claims": 12
  },
  "schema_set_hash": "sha256:4dac83cac00627ca5aafa74a2d3b9bf1ebb54f397cf91ac8c575c51a9eb2b2b0",
  "created_at": "2026-07-09T07:04:16Z"
}
