{
  "schema": "session.v1",
  "session_id": "cmp",
  "question": "量化宽松(QE,2008-2021)在多大程度上是发达经济体(以美国为主)财富不平等扩大的『原因』,而非人口老龄化、技术偏向性进步、全球化等结构性力量在反事实情形下本来也会造成的结果?请区分资产价格渠道、储蓄者/借款者再分配渠道与宏观(就业/工资)渠道,并直面因果识别难题:如何把 QE 的边际因果效应从同期其他趋势中分离出来?给出有校准的判断。",
  "boundary_note": "范围:发达经济体、以美国为主(旁及欧元区/英国/日本);时段 2008–2021 的 QE(QE1–QE3、疫情 QE);结果变量=财富(净资产)不平等,兼顾收入不平等。焦点=QE 的边际因果贡献 vs 老龄化/技术偏向性进步/全球化等结构性反事实。三渠道:资产价格、储蓄者-借款者再分配、宏观(就业/工资)。不含:加密货币、财政转移支付主导的疫情救助细节、2022 后加息周期。",
  "language": "zh",
  "budgets": {
    "max_depth": 3,
    "max_children": 6,
    "max_open_claims": 15
  },
  "schema_set_hash": "sha256:4dac83cac00627ca5aafa74a2d3b9bf1ebb54f397cf91ac8c575c51a9eb2b2b0",
  "created_at": "2026-07-09T08:55:44Z"
}
