{
  "schema": "session.v1",
  "session_id": "cmp",
  "question": "中国的人口下降与快速老龄化,是否必然导致类似日本『失去的数十年』式的长期停滞?自动化/机器人替代、全要素生产率增长、劳动参与率提升(延迟退休、女性/农民工市民化)与制度改革,能在多大程度上抵消劳动力萎缩对潜在增长的拖累?对比中日在发展阶段、资本回报率、债务与政策空间上的差异,并直面反方。给出有校准的判断。",
  "boundary_note": "聚焦2025–2050中国潜在增长轨迹与日本1990后停滞的可比性:人口/老龄化拖累 vs 抵消项(自动化机器人、TFP、劳动参与率=延迟退休+女性+农民工市民化、制度改革);中日在发展阶段/人均GDP追赶空间、资本边际回报、债务与财政货币政策空间上的差异;含反方。排除:短期周期波动、地缘/贸易战本身、非经济议题。",
  "language": "zh",
  "budgets": {
    "max_depth": 3,
    "max_children": 6,
    "max_open_claims": 15
  },
  "schema_set_hash": "sha256:4dac83cac00627ca5aafa74a2d3b9bf1ebb54f397cf91ac8c575c51a9eb2b2b0",
  "created_at": "2026-07-09T10:12:59Z"
}
