{
  "schema": "session.v1",
  "session_id": "cmp",
  "question": "最低工资上调是否降低就业?请以2015-2024年美国州级/城市级『自然实验』为主要证据,调和Card-Krueger式准实验(常发现就业效应很小甚至接近零)与竞争性劳动力市场理论(预测就业下降)之间的张力。垄断买方(monopsony)、成本转嫁(涨价)、雇主对非工资条件的调整(工时、福利、招聘门槛、自动化)等机制各自扮演什么角色?就业效应是否随上调幅度/相对中位数工资的比值而非线性变化?给出有校准的判断。",
  "boundary_note": "美国2015-2024年州/城市级最低工资自然实验证据;聚焦就业弹性、垄断买方模型、成本转嫁、非工资边际调整、上调幅度非线性效应;不涉及联邦最低工资立法史或其他国家案例",
  "language": "zh",
  "budgets": {
    "max_depth": 4,
    "max_children": 5,
    "max_open_claims": 12
  },
  "schema_set_hash": "sha256:4dac83cac00627ca5aafa74a2d3b9bf1ebb54f397cf91ac8c575c51a9eb2b2b0",
  "created_at": "2026-07-09T07:05:08Z"
}
